{
  "schema_version": "1.0",
  "metadata": {
    "generated_at": "2026-01-02T03:04:05Z",
    "git_sha": "0123456789abcdef0123456789abcdef01234567",
    "artifact_sha256": "0000000000000000000000000000000000000000000000000000000000000000"
  },
  "models": [
    {
      "type": "ChatOpenAI",
      "model": "gpt-4o-mini",
      "source_file": "app.py",
      "provenance": {
        "provider_endpoint": "https://api.openai.com",
        "registry_uri": null,
        "immutable_version": null,
        "environment": null,
        "region": null,
        "evidence": {
          "provider_endpoint": {
            "status": "observed",
            "method": "observed:static-fixture"
          },
          "registry_uri": {
            "status": "missing",
            "method": "not-observed"
          },
          "immutable_version": {
            "status": "missing",
            "method": "not-observed"
          },
          "environment": {
            "status": "missing",
            "method": "not-observed"
          },
          "region": {
            "status": "missing",
            "method": "not-observed"
          }
        }
      }
    }
  ],
  "datasets": [],
  "tools": [],
  "frameworks": [],
  "prompts": [],
  "scan_findings": [],
  "risk_findings": [
    {
      "id": "sample",
      "category": "third-party dependency",
      "owasp_llm": "LLM07 Insecure Plugin Design",
      "heuristic": "true"
    }
  ],
  "coverage_summary": {
    "detectors": [],
    "unsupported_total": 0
  },
  "unsupported_artifacts": [],
  "runtime_context": {
    "provider_endpoint": null,
    "registry_uri": null,
    "immutable_version": null,
    "environment": null,
    "region": null,
    "evidence": {
      "provider_endpoint": {
        "status": "missing",
        "method": "not-observed"
      },
      "registry_uri": {
        "status": "missing",
        "method": "not-observed"
      },
      "immutable_version": {
        "status": "missing",
        "method": "not-observed"
      },
      "environment": {
        "status": "missing",
        "method": "not-observed"
      },
      "region": {
        "status": "missing",
        "method": "not-observed"
      }
    }
  }
}
