{
  "schema_version": "1.0",
  "metadata": {
    "generated_at": "2026-01-02T03:04:05Z",
    "git_sha": "0123456789abcdef0123456789abcdef01234567",
    "artifact_sha256": "0000000000000000000000000000000000000000000000000000000000000000"
  },
  "models": [
    {
      "type": "ConfigModelHint",
      "model": "gpt-4.1-mini",
      "source_file": "settings.yaml",
      "source_type": "config",
      "confidence": "medium",
      "provenance": {
        "provider_endpoint": null,
        "registry_uri": null,
        "immutable_version": null,
        "environment": null,
        "region": null,
        "evidence": {
          "provider_endpoint": {
            "status": "missing",
            "method": "not-observed"
          },
          "registry_uri": {
            "status": "missing",
            "method": "not-observed"
          },
          "immutable_version": {
            "status": "missing",
            "method": "not-observed"
          },
          "environment": {
            "status": "missing",
            "method": "not-observed"
          },
          "region": {
            "status": "missing",
            "method": "not-observed"
          }
        }
      }
    },
    {
      "type": "ChatOpenAI",
      "model": "gpt-4o-mini",
      "source_file": "app.py",
      "provenance": {
        "provider_endpoint": "https://api.openai.com",
        "registry_uri": null,
        "immutable_version": null,
        "environment": null,
        "region": null,
        "evidence": {
          "provider_endpoint": {
            "status": "observed",
            "method": "observed:static-fixture"
          },
          "registry_uri": {
            "status": "missing",
            "method": "not-observed"
          },
          "immutable_version": {
            "status": "missing",
            "method": "not-observed"
          },
          "environment": {
            "status": "missing",
            "method": "not-observed"
          },
          "region": {
            "status": "missing",
            "method": "not-observed"
          }
        }
      }
    },
    {
      "type": "ChatOpenAI",
      "model": "gpt-4o-mini",
      "source_file": "demo.ipynb#cell-0",
      "provenance": {
        "provider_endpoint": "https://api.openai.com",
        "registry_uri": null,
        "immutable_version": null,
        "environment": null,
        "region": null,
        "evidence": {
          "provider_endpoint": {
            "status": "observed",
            "method": "observed:static-fixture"
          },
          "registry_uri": {
            "status": "missing",
            "method": "not-observed"
          },
          "immutable_version": {
            "status": "missing",
            "method": "not-observed"
          },
          "environment": {
            "status": "missing",
            "method": "not-observed"
          },
          "region": {
            "status": "missing",
            "method": "not-observed"
          }
        }
      }
    }
  ],
  "datasets": [
    {
      "type": "FAISS.from_texts",
      "source_file": "app.py"
    }
  ],
  "tools": [
    {
      "name": "initialize_agent",
      "source_file": "app.py"
    }
  ],
  "frameworks": [
    {
      "name": "langchain"
    },
    {
      "name": "openai"
    }
  ],
  "prompts": [
    {
      "id": "app.py:9",
      "source_file": "app.py"
    }
  ],
  "scan_findings": [
    {
      "id": "js-ts-deps:package.json",
      "category": "dependency graph",
      "source_type": "js_ts_manifest",
      "source_file": "package.json",
      "severity": "medium",
      "confidence": "medium",
      "evidence": "Detected JS/TS dependencies: langchain, openai"
    },
    {
      "id": "config:model:settings.yaml",
      "category": "model configuration",
      "source_type": "config",
      "source_file": "settings.yaml",
      "severity": "medium",
      "confidence": "high",
      "evidence": "model=[masked:gp********ni hash:13a647d426a0]"
    },
    {
      "id": "python-model:ChatOpenAI:app.py",
      "category": "model invocation",
      "source_type": "python",
      "source_file": "app.py",
      "severity": "medium",
      "confidence": "high",
      "evidence": "Model class ChatOpenAI detected in Python source."
    },
    {
      "id": "config:provider:settings.yaml",
      "category": "provider configuration",
      "source_type": "config",
      "source_file": "settings.yaml",
      "severity": "medium",
      "confidence": "high",
      "evidence": "provider=[masked:op**ai hash:7d3194f79e64]"
    },
    {
      "id": "config:anthropic_api_key:.env",
      "category": "provider credential",
      "source_type": "config",
      "source_file": ".env",
      "severity": "high",
      "confidence": "medium",
      "evidence": "ANTHROPIC_API_KEY=[masked:an*****st hash:25e2f144a82b]"
    },
    {
      "id": "config:openai_api_key:.env",
      "category": "provider credential",
      "source_type": "config",
      "source_file": ".env",
      "severity": "high",
      "confidence": "medium",
      "evidence": "OPENAI_API_KEY=[masked:sk*********ue hash:928d882b4239]"
    }
  ],
  "coverage_summary": {
    "detectors": [
      {
        "source_type": "config",
        "artifacts_seen": 3,
        "artifacts_scanned": 3,
        "default_confidence": "medium"
      },
      {
        "source_type": "js_ts_manifest",
        "artifacts_seen": 1,
        "artifacts_scanned": 1,
        "default_confidence": "medium"
      },
      {
        "source_type": "jupyter_notebook",
        "artifacts_seen": 1,
        "artifacts_scanned": 1,
        "default_confidence": "medium"
      },
      {
        "source_type": "python",
        "artifacts_seen": 1,
        "artifacts_scanned": 1,
        "default_confidence": "high"
      },
      {
        "source_type": "runtime_manifest",
        "artifacts_seen": 0,
        "artifacts_scanned": 0,
        "default_confidence": "medium"
      }
    ],
    "unsupported_total": 1
  },
  "unsupported_artifacts": [
    {
      "path": "script.ts",
      "artifact_type": ".ts",
      "reason": "No enabled detector covers this source artifact type."
    }
  ],
  "source_types": [
    {
      "name": "python",
      "default_severity": "medium",
      "default_confidence": "high"
    },
    {
      "name": "jupyter_notebook",
      "default_severity": "medium",
      "default_confidence": "medium"
    },
    {
      "name": "config",
      "default_severity": "medium",
      "default_confidence": "medium"
    },
    {
      "name": "runtime_manifest",
      "default_severity": "medium",
      "default_confidence": "medium"
    },
    {
      "name": "js_ts_manifest",
      "default_severity": "medium",
      "default_confidence": "medium"
    }
  ],
  "runtime_context": {
    "provider_endpoint": null,
    "registry_uri": null,
    "immutable_version": null,
    "environment": null,
    "region": null,
    "evidence": {
      "provider_endpoint": {
        "status": "missing",
        "method": "not-observed"
      },
      "registry_uri": {
        "status": "missing",
        "method": "not-observed"
      },
      "immutable_version": {
        "status": "missing",
        "method": "not-observed"
      },
      "environment": {
        "status": "missing",
        "method": "not-observed"
      },
      "region": {
        "status": "missing",
        "method": "not-observed"
      }
    }
  },
  "risk_findings": [
    {
      "id": "prompt-injection-surface:prompt_templates:",
      "rule_id": "prompt-injection-surface",
      "base_rule_id": "prompt-injection-surface",
      "category": "prompt injection surface",
      "owasp_llm": "LLM01 Prompt Injection",
      "severity": "medium",
      "rationale": "Prompt templates detected; review source trust boundaries.",
      "heuristic": "true"
    },
    {
      "id": "third-party-provider:ChatOpenAI:app.py",
      "rule_id": "third-party-provider",
      "base_rule_id": "third-party-provider",
      "category": "third-party dependency",
      "owasp_llm": "LLM07 Insecure Plugin Design",
      "severity": "medium",
      "rationale": "External model provider detected.",
      "heuristic": "true"
    },
    {
      "id": "third-party-provider:ChatOpenAI:demo.ipynb#cell-0",
      "rule_id": "third-party-provider",
      "base_rule_id": "third-party-provider",
      "category": "third-party dependency",
      "owasp_llm": "LLM07 Insecure Plugin Design",
      "severity": "medium",
      "rationale": "External model provider detected.",
      "heuristic": "true"
    }
  ],
  "risk_policy": {
    "policy": {
      "policy_id": "builtin-default",
      "version": "1",
      "source": "builtin",
      "sha256": "cce9851d3aae4c7a1e5d364e0af054db66af01930f76035e1fdac87727dee91a"
    },
    "applied_rules": [
      {
        "base_rule_id": "prompt-injection-surface",
        "rule_id": "prompt-injection-surface",
        "severity": "medium",
        "threshold": 1,
        "candidate_count": 1,
        "post_allowlist_count": 1
      },
      {
        "base_rule_id": "third-party-provider",
        "rule_id": "third-party-provider",
        "severity": "medium",
        "threshold": 1,
        "candidate_count": 2,
        "post_allowlist_count": 2
      }
    ],
    "suppressed": []
  }
}
